category,processed_message
spam,tried contact offer new video phone 750 anytime network mins half price rental camcorder call 08000930705 reply delivery wed
ham,doctor 1tulsi cancer fat 1cup bone problms 3 litres diseases snd ths 2 u care
ham,says hi get ass back south tampa preferably kegger
ham,hahaha use brain dear
ham,text way cup stop work bus
ham,spring coming early yay
ham,whole car appreciated last two dad map reading semi argument apart things going p
ham,shall fine avalarr hollalater
ham,got lousy sleep kept waking every 2 hours see cat wanted come worry cold
ham,cool time think get
ham,friends u stay fb chat
ham,nope going home go pump petrol lor like going 2 rain soon
spam,free ringtone text first 87131 poly text get 87131 true tone help 0845 2814032 16 1st free tones txt stop
ham,takin shower yeah leave done
ham,sorry got things may pub later
ham,true dear sat pray evening felt sms time
ham,know god created gap fingers one made comes amp fills gaps holding hand love
ham,ok thanx
spam,guaranteed cash claim yr prize call customer service representative
ham,much blackberry bold2 nigeria
ham,hey u still gym
ham,gud ni8 dear slp well take care swt dreams muah
ham,says give call friend got money definitely buying end week
spam,hi 2nights ur lucky night uve invited 2 xchat uks wildest chat txt chat 86688 ldn 18yrs
ham,ya one slow poo
spam,congratulations ur awarded 500 cd vouchers 125gift guaranteed free entry 2 100 wkly draw txt music 87066
ham,telly brdget jones
ham,im realy soz imat mums 2nite 2moro
ham,sure whenever show fuck gt
ham,engalnd telly decided wo let watch mia elliot kissing damn
ham,much though h friday cant wait dunno wot hell im gon na another 3 weeks become oh wait already done
ham,long beach lor expected u dinner
ham,oh yah never cancel leh haha
ham,know thing wrong everyso often panicks starts goin bout bein good enough
ham,hi mate rv u hav nice hol message 3 say hello coz sent u 1 ages started driving stay roads rvx
ham,thts wat wright brother fly
ham,nt goin got somethin unless meetin 4 dinner lor haha wonder go tis time
ham,glad see reply
ham,send ur friends receive something ur voice speaking expression attitude lt gt lt gt reply
spam,want new video handset 750 anytime network mins half price line rental camcorder reply call 08000930705 delivery tomorrow
ham,near kalainar tv
ham,er yeah b sorry tell sit come wen u
ham,hmm thinking lor
ham,yes thought thanks
ham,k actually guys meet sunoco howard right way
ham,busy juz dun wan 2 go early hee
spam,u subscribed best mobile content service uk per 10 days send stop helpline 08706091795
spam,urgent trying contact todays draw shows prize guaranteed call 09050001808 land line claim m95 valid12hrs
ham,got salt rub open wounds like
ham,u going doctor 4 liver get bit stylish get ur hair managed thats
ham,g says never answer texts
ham,wud never mind u dont miss u dont need u wil really hurt wen u need amp u dont tell take care
ham,yup still coffee wif frens fren drove give lift
spam,chance reality fantasy show call 08707509020 20p per min ntt ltd po box 1327 croydon cr9 5wb 0870 national rate call
ham,beauty life next second hides thousands secrets wish every second wonderful ur life gud n8
spam,taking part mobile survey yesterday 500 texts 2 use however wish 2 get txts send txt 80160 c
ham,ya well bbd pooja full pimples even become quite black ur rite cold wearing sweatter
ham,hello r u im bored inever thought id get bored tv tell something exciting happened anything
ham,keep ur problems ur heart nobody fight u amp u fight ur self amp win battle g 9t sd ham yeah give call got minute ham hi babe uawake feellikw via aletter thatmum gotmarried ourbacks fuckinnice selfish call u
ham,ok chikku 1 favourite song
spam,urgent trying contact last weekends draw shows prize guaranteed call claim code k61 valid 12hours
ham,dont send plus mode
ham,told tell stupid hear wont tell anything dad called brother spoken
ham,hey doc pls want get nice shirt hubby nice fiting ones budget lt gt k help pls load card abi hw keep posted luv 2 mj
ham,2 docs appointments next week tired shoving stuff ugh could normal body
ham,well done blimey exercise yeah kinda remember wot hmm
ham,twenty past five said train durham already coz reserved seat
ham,bruce amp fowler mom car ca park long story
ham,av new number wil u use one ta
ham,u going ikea str aft dat
ham,sure still available though
ham,u make fb list
spam,hello darling today would love chat dont tell look like sexy
ham,yeah leave maybe 7ish
spam,rgent 2nd attempt contact u u call 09071512433 b4 050703 csbcm4235wc1n3xx callcost 150ppm mobilesvary 50
ham,wen ur lovable bcums angry wid u dnt take seriously coz angry childish n true way showing deep affection care n luv kettoda manda nice day da
ham,text creepy like wo think forgot
ham,nah man car meant crammed full people
ham,good find way
ham,oic saw tot din c found group liao
spam,unique enough find 30th august
ham,surprised still guess right lor
ham,dont thnk wrong calling us
spam,someonone know trying contact via dating service find could call mobile landline 09064015307 box334sk38ch
ham,also knows lunch menu da know
ham,gudnite tc practice going
ham,k roommate also wants dubsack another friend may also want plan bringing extra tell know sure
ham,lei
ham,usual iam fine happy amp well
ham,hey babe saw came online second disappeared happened
spam,themob check newest selection content games tones gossip babes sport keep mobile fit funky text wap 82468
ham,movie theatre go watch unlimited movies pay
spam,xmas prize draws trying contact todays draw shows prize guaranteed call 09058094565 land line valid 12hrs
spam,warner village 83118 c colin farrell swat wkend warner village get 1 free med popcorn show c c kiosk reply sony 4 mre film offers
ham,may b approve panalam posts
ham,guys asking get slippers gone last year
ham,havent shopping lor juz arrive
ham,nowadays people notixiquating laxinorficated opportunity bambling entropication ever oblisingately opted ur books masteriastering amplikater fidalfication champlaxigating think atrocious wotz ur opinion junna
ham,hey babe friend cancel still visit
ham,e admin building might b slightly earlier call u reaching
ham,ever easier
ham,dun believe wat
ham,much bad avoid like
spam,500 new mobiles 2004 must go txt nokia 89545 collect today 2optout
ham,sorry lot stuff talk actual guy wants buy
spam,wo believe true incredible txts reply g learn truly amazing things blow mind o2fwd
spam,hmv bonus special 500 pounds genuine hmv vouchers answer 4 easy questions play send hmv 86688 info
ham,reached home n bathe liao u call
spam,get free mobile video player free movie collect text go free extra films ordered c apply 18 yrs
spam,urgent mobile awarded bonus caller prize final try contact u call landline 09064019788 box42wr29c 150ppm
ham,going
ham,got mail panren paru
ham,dun believe leh tot told true already thk muz c us tog believe
ham,got home babe still awake
ham,wish holding tightly making see important much mean much need life
spam,bangbabes ur order way u receive service msg 2 download ur content u goto wap bangb tv ur mobile menu
ham,yup free
ham,ok careful text drive
ham,correct work today
spam,free video camera phones half price line rental 12 mths 500 cross ntwk mins 100 txts call mobileupd8 08001950382
ham,askd u question hours answer
spam,ur chance win cash every wk txt action c custcare 08712405022
ham,frens go lor alone wif mum n sis lor
ham,sunday holiday work
ham,house water dock boat rolled newscaster dabbles jazz flute behind wheel
ham,bookedthe hut also time way
ham,solihull want anything
spam,santa calling would little ones like call santa xmas eve call 09058094583 book time
ham,sorry dude dont know forgot even dan reminded sorry hope guys fun
ham,6times
ham,asked call ok
ham,u got persons story
ham,cool text way
ham,kothi print marandratha
spam,urgent mobile number awarded prize guaranteed call 09061790121 land line claim valid 12hrs 150ppm
ham,oh 4 outside players allowed play know
ham,yo dude guess got arrested day
ham,time ur flight tmr
ham,nothing spl wat abt u whr ru
ham,yeah probs last night obviously catching speak soon
ham,still looking car buy gone 4the driving test yet
ham,hate turns fun shopping trip annoying day everything would look house
spam,upgrdcentre orange customer may claim free camera phone upgrade loyalty call 0207 153 offer ends 26th july c apply available
ham,spend days waiting ideal path appear front us forget paths made walking waiting goodnight
ham,anything lor juz us lor
ham,wo move morphine
ham,wondering others took
ham,sorry pain ok meet another night spent late afternoon casualty means done stuff42moro includes time sheets sorry
ham,hi got money da
ham,lol yes friendship hanging thread cause u wo buy stuff
ham,way going back
ham,went ganesh dress shop
ham,im snowboarding trip wondering planning get everyone together befor go meet greet kind affair cheers
spam,thanks ringtone order ref number r836 mobile charged tone arrive please call customer services 09065069154
ham,thanx yup coming back sun finish dinner going back 2 hotel time flies tog 4 exactly mth today hope haf many mths come
ham,possible
ham,exhausted train morning much wine pie sleep well
ham,honeymoon outfit
ham,place talk explain
ham,happened interview
ham,r giving second chance rahul dengra
spam,u secret admirer looking 2 make contact r reveal thinks ur 09058094594
ham,hello beautiful r u ok kinda ad row wiv walked pub wanted night wiv u miss u
ham,mag meeting avo point
ham,need get
ham,sorry delay yes masters
ham,ok lor
ham,2 babe feel lets 4get try fit soo muchxxlove u locaxx
ham,finally match heading towards draw prediction
spam,fancy shag txt xxuk suzy txts cost per msg tncs website x
ham,yeah confirmed staying weekend
ham,could read love answered
ham,cool text
ham,ü predict wat time ü finish buying
ham,sday training started today
spam,74355 xmas iscoming ur awarded either cd gift vouchers free entry 2 r weekly draw txt music 87066 tnc
ham,miss much desparate recorded message left day listen hear sound voice love
ham,hey angry reply dr
ham,feathery bowa something guys know
ham,makes happy
ham,sac needs carry
spam,u r winner u ave specially selected 2 receive cash 4 holiday flights inc speak live operator 2 claim 18
ham,unbelievable faglord
spam,urgent mobile 07xxxxxxxxx bonus caller prize 2nd attempt reach call 09066362231 asap box97n7qp 150ppm
ham,putting ready lt time gt
ham,k k much cost
ham,aiyo please ü got time meh
ham,mean left early check cos working
ham,eh ur laptop got stock lei say mon muz come take look c got
ham,going take babe
ham,family responding anything room went home diwali one called coming makes feel like died
ham,wanted wish happy new year wanted talk legal advice gary split person make trip ptbo hope everything good babe love ya
spam,txt call 86888 claim reward 3 hours talk time use phone inc 3hrs 16 stop txtstop
ham,parents kidz friends n colleagues screaming surprise waiting sofa naked
ham,sitting ard nothing lor u leh busy w work
ham,dont knw pa drink milk
ham,hmph go head big baller
ham,actually fuck whatever find excuse tampa point january though
ham,india take lead
spam,mobile 11 months u r entitled update latest colour mobiles camera free call mobile update co free 08002986030
ham,damn poor zac stand chance
ham,tap spile seven pub gas st broad st canal ok
ham,storming msg wen u lift phne u say hello u knw wt real meaning hello name girl yes u knw dat girl margaret hello girlfrnd f grahmbell invnted telphone moral one 4get name person bt girlfrnd g n g h
ham,like talk pa able dont know
ham,sure time tho sure get library class try see point good eve
ham,late
ham,love ya try budget money better babe gary would freak knew
ham,lol gon na last month cashed left lt gt case collecting week cause announced blog
spam,urgent ur awarded complimentary trip eurodisinc trav aco entry41 claim txt dis 87121 morefrmmob shracomorsglsuplt 10 ls1 3aj
ham,easy ah sen got selected means good
ham,chill another 6hrs could sleep pain surgical emergency see unfolds okay
ham,none nowhere ikno doesdiscount shitinnit
ham,oh fuck juswoke bed boatin docks slept wid 25 year old spinout giv u da gossip l8r xxx
spam,44 7732584351 want new nokia 3510i colour phone deliveredtomorrow 300 free minutes mobile 100 free texts free camcorder reply call 08000930705
ham,get second half message
ham,thank much skyped wit kz sura didnt get pleasure company hope good given ultimatum oh countin aburo enjoy
ham,aah cuddle would lush need lots tea soup kind fumbling
ham,possession especially first offense
spam,gr8 poly tones 4 mobs direct 2u rply poly title 8007 eg poly breathe1 titles crazyin sleepingwith finest ymca pobox365o4w45wq 300p
ham,well good morning mr hows london treatin ya treacle
ham,customer place wil cal u sir
spam,free ringtone waiting collected simply text password mix 85069 verify get usher britney fml po box 5249 mk17 92h 450ppw 16
ham,chinatown got porridge claypot rice yam cake fishhead beehoon either eat cheap den go cafe n tok go nydc somethin
ham,happy new year hope good semester
ham,love aathi love u lot
ham,gud mrng dear hav nice day
ham,pleassssssseeeeee tel v avent done sportsx
ham,ok lar double check wif da hair dresser already said wun cut v short said cut look nice
ham,heard anything answering texts guessing flaked said jb fantastic
ham,wif family booking tour package
ham,really sorry wo b able 2 u find yr term going ok
spam,hello need posh birds chaps user trial prods champneys put need address dob asap ta r
spam,4 costa del sol holiday await collection call 09050090044 toclaim sae tc pobox334 stockport sk38xh max10mins
spam,someone conacted dating service entered phone fancy find call landline pobox12n146tf15
ham,ü send contents page
ham,yes last week taking live call
ham,heart empty without love mind empty without wisdom eyes r empty without dreams amp life empty without frnds alwys touch good night amp sweet dreams
ham,ca number
ham,free
ham,sister going earn da
ham,lol need cash nitros hurry come crash
ham,doubt could handle 5 times per night case
ham,home watching tv lor
ham,look frying pan case cheap book perhaps silly frying pan likely book
ham,hello going village pub 8 either come accordingly ok
spam,2nd time tried 2 contact u 750 pound prize 2 claim easy call 08712101358 10p per min
ham,necessarily respectful
ham,yeah stand close catch something
spam,monthlysubscription csc web age16 2stop txt stop
ham,1 thing change sentence want 2 concentrate educational career im leaving
ham,come round
spam,b4u voucher marsms log onto discount credit opt reply stop customer care call 08717168528
ham,good wondering wont say hi smiling coping long distance
spam,private 2003 account statement shows 800 points call 08718738001 identifier code 49557 expires
ham,planning come chennai
ham,total video converter free download type google search
ham,surly ill give coming review
ham,hamster dead hey tmr meet 1pm orchard mrt
ham,waiting call sir
ham,wishing great day moji told offer always speechless offer easily go great lengths behalf stunning exam next friday keep touch sorry
ham,wish think gon na snow much flurries usually get melt hit ground eek snow since lt gt even born
ham,actor work work evening sleep late since unemployed moment always sleep late unemployed every day saturday
ham,oh come ah
ham,early bird purchases yet
ham,oh ok didnt know meant yep baby jontin
ham,give something drink takes vomit temp might drop unmits however let know
ham,ya srsly better yi tho
spam,ur currently 500 pounds maximize ur send go 86688 cc 08718720201
ham,lots used ones babe model help youi bring match
ham,happy babe woo hoo party dude
spam,winner valued network customer selected receivea prize reward claim call claim code kl341 valid 12 hours
ham,appt lt time gt fault u listen told u twice
ham,saw guys dolls last night patrick swayze great
ham,yep great loxahatchee xmas tree burning lt gt starts hour
ham,u fix teeth take care
ham,sorry call later
ham,say thanks2
ham,wnt buy bmw car urgently vry hv shortage lt gt source arng dis amt lt gt lacs thats prob
ham,nationwide auto centre something like newport road liked
ham,x2 lt gt going get
ham,moon come color dreams stars make musical sms give warm peaceful sleep good night
ham,yup
ham,good afternoon boytoy feeling today better hope good boy obedient slave please queen
ham,ok c ü
ham,lot sickness thing going round take easy hope u feel better soon lol
ham,electricity went fml
ham,worry sure get
ham,hey sathya till dint meet even single time saw situation sathya
ham,jus chillaxin
ham,seriously spell name
ham,people mu table lambda
ham,u switch fone dammit
ham,al moan n e thin goes wrong fault al de arguments r fault fed himso bother hav 2go
ham,yup msg tat yijue tot group mate cos meeting today mah askin ü leaving earlier wat mah cos mayb ü haf walk v far
ham,r ü comin back dinner
spam,please call amanda regard renewing upgrading current handset free charge offer ends today tel 0845 021 3680 subject c
spam,text pass 69669 collect polyphonic ringtones normal gprs charges apply enjoy tones
ham,sure thing big man hockey elections 6 go longer hour though
spam,next amazing xxx picsfree1 video sent enjoy one vid enough 2day text back keyword picsfree1 get next video
ham,dog must always wait till end day word run time cell already
ham,painful personal always try keep everybody happy time nobody recognises alone
ham,literally bed like lt gt hours
spam,text banneduk 89555 see cost 150p textoperator g696ga xxx
ham,murderer coz man murdered lt gt th january public holiday closed including post office understand
ham,hmmm k want change field quickly da wan na get system administrator network administrator
ham,get gift year didnt get anything bad
ham,reach ard 20 mins ok
ham,got hella gas money want go grand nature adventure galileo little bit
ham,u turn heater heater set lt gt degrees
ham,webpage available
spam,100 dating service cal l 09064012103 box334sk38ch
spam,ringtone club gr8 new polys direct mobile every week
ham,lol would mom would fit tell whole family crazy terrible
ham,still chance search hard get let try
ham,yun buying school got offer 2000 plus
ham,reading text sent meant joke read light
ham,aww must nearly dead well jez iscoming todo workand whilltake forever
ham,whatsup dont u want sleep
ham,kallis wont play first two odi
spam,freemsg hi baby wow got new cam moby wan na c hot pic fancy chat im w8in 4utxt rply chat 82242 hlp 08712317606 msg150p 2rcv
ham,japanese proverb one u none u must indian version one let none leave finally kerala version one stop none make strike
ham,u really pig leh sleep much dad wake 10 smth 2 eat lunch today
ham,free give otherwise nalla adi entey nattil kittum
ham,oh yeah clearly fault
ham,fuuuuck need stop sleepin sup
ham,sorry missed call please call back
ham,mmmmmm love much ahmad ca wait year begin every second takes closer side happy new year love
ham,aiyo u always c ex one dunno abt mei reply first time u reply fast lucky workin huh got bao ur sugardad ah gee
ham,teach apps da come college
ham,wet right
spam,account credited 500 free text messages activate txt word credit 80488 cs
ham,dear got train seat mine lower seat
ham,get ten billion calls texts help god
ham,also track lighters find
spam,contract mobile 11 mnths latest motorola nokia etc free double mins text orange tariffs text yes callback remove records
ham,congratulations ore mo owo wa enjoy wish many happy moments fro wherever go
ham,hey check da listed da
ham,going good problem still need little experience understand american customer voice
ham,sun anti sleep medicine
ham,ok
ham,supposed could make still town though
ham,tell thinking plus going stop runs
ham,mm entirely sure understood text hey ho weekend
ham,kind took garage centre part exhaust needs replacing part ordered n taking fixed tomo morning
spam,get garden ready summer free selection summer bulbs seeds worth scotsman saturday stop go2
ham,moment day brings hope afternoon brings faith evening brings luv night brings rest wish u find morning
ham,know mallika sherawat yesterday find lt url gt
spam,free game get rayman golf 4 free o2 games arcade 1st get ur games settings reply post save activ8 press 0 key arcade termsapply
ham,cps causing outages conserve energy
ham,ok
ham,yes outside like 2 hours called whole family wake cause started 1
spam,18 days euro2004 kickoff u kept informed latest news results daily unsubscribe send get euro stop 83222
ham,enufcredeit ileave uni 6 bus yor house
ham,went fast asleep care
spam,good luck draw takes place 28th feb good luck removal send stop 87239 customer services 08708034412
ham,lmao know well
ham,boy late 2 home father power frndship
ham,ard 6 like dat lor
ham,donno scorable
spam,know someone know fancies call 09058097218 find pobox 6 ls15hb 150p
ham,wat time ü finish
ham,oops let know roommate done
ham,hmmm thk sure got time hop ard ya go 4 free abt muz call u discuss liao
ham,audrie lousy autocorrect
spam,88800 89034 premium phone services call 08718711108
ham,know raping dudes poker
ham,trying weekend v
ham,tell happen dont behave like ok need say
ham,want send virtual hug need one
ham,go fool dont cheat others ok
ham,much payed suganya
ham,stuff sell tell
ham,jus reached home go bathe first sis using net tell u finishes k
ham,go chase run crossing street
ham,sent email address incomm right
ham,pic please
ham,ok
ham,whats staff name taking class us
ham,guy browsin compulsory
spam,england v macedonia dont miss news txt ur national team 87077 eg england 87077 try wales scotland poboxox36504w45wq
ham,u haf 2 keep busy
ham,sleeping surfing
ham,oh ho first time u use type words
ham,really good see day dudette missing
ham,way tirupur
ham,dear shall mail street shall update looking edukkukayee raksha good one real sense
ham,going sleep tired travel
ham,meh thgt clash really ah dun mind dun seen lost weight gee
ham,sian aft meeting supervisor got work 2 liao u working
spam,hmv bonus special 500 pounds genuine hmv vouchers answer 4 easy questions play send hmv 86688 info
ham,hey r watching movie tonight prob b home early
ham,nvm take ur time
ham,think spatula hands
spam,smsservices yourinclusive text credits pls goto 3qxj9 unsubscribe stop extra charge help 9ae
ham,k give sec breaking lt gt cstore
ham,love girls office may wonder smiling sore
ham,getting anywhere damn job hunting
ham,hey babe going ever figure going new years
ham,good afternoon love goes day woke early online waiting hmmm italian boy online see grins
spam,someone u know asked dating service 2 contact cant guess call 09058095107 revealed pobox 7 s3xy 150p
ham,hey mr whats name bill brison book one language words
ham,pls help tell sura expecting battery hont pls send message download movies thanks
ham,give one miss number please
ham,yup
ham,haha okay today weekend leh
spam,private 2003 account statement shows 800 points call 08715203685 identifier expires
ham,lul im gettin juicy gossip hospital two nurses talking fat gettin one thinks shes obese oyea
ham,searching good dual sim mobile pa
ham,play w computer aiyah tok 2 u lor
ham,ya even cookies jelly
ham,knew time murder exactly
spam,congratulations thanks good friend u xmas prize 2 claim easy call 08718726978 10p per minute
spam,ur chance win cash every wk txt action c custcare 08712405022
ham,time tell friend around
ham,cant pick phone right pls send message
ham,boy love u grl hogolo boy gold chain kodstini grl agalla boy necklace madstini grl agalla boy hogli 1 mutai eerulli kodthini grl love u kano
ham,come sec somebody want see
spam,hi babe chloe r u smashed saturday night great weekend u missing sp text stop stop
ham,thinking u x
ham,lt gt bucks banks fees fixed better call bank find
ham,send ur birthdate month year tel u ur life partner name method calculation reply must
ham,good morning love go sleep wish great day full feeling better opportunity last thought babe love kiss
spam,urgent ur guaranteed award still unclaimed call 09066368327 claimcode m39m51
spam,well done 4 costa del sol holiday await collection call 09050090044 toclaim sae tcs pobox334 stockport sk38xh max10mins
ham,want grasp pretty booty
ham,much dirty fellow
ham,okay lor still let us go ah coz know later drop cards box right
ham,sea lays rock rock envelope envelope paper paper 3 words
ham,7 esplanade ü mind giving lift cos got car today
ham,town important
ham,hope settled new school year wishin gr8 day
ham,class hours sorry
spam,great new offer double mins double txt best orange tariffs get latest camera phones 4 free call mobileupd8 free 08000839402 2stoptxt cs
ham,telling coulda real valentine u never pick nothing
spam,free entry weekly competition text word win 80086 18 c
ham,oooh bed ridden ey thinking
ham,carlos taking sweet time usual let know patty smoke tell haul ass
ham,bognor splendid time year
ham,hey kate hope ur ok give u buz wedlunch go outsomewhere 4 adrink town cud go 2watershd 4 bit ppl fromwrk bthere love petexxx
ham,thanks honey still heard anything leave bit longer 2 crowd try later great advice thanks hope cardiff still
ham,happen behave like
ham,respond imma assume still asleep imma start calling n shit
ham,come people
spam,u win music gift vouchers every week starting txt word draw 87066 tscs skillgame 1winaweek age16 150ppermesssubscription
ham,ü come lt 25 n pass lar
ham,great comedy cant stop laughing da
ham,actual exam harder nbme
ham,yesterday true true
ham,ding ya break fassyole blacko londn
ham,sitting mu waiting everyone get suite take shower
spam,dear voucher holder claim weeks offer pc please go http ts cs apply
ham,creepy crazy
ham,r e meeting tmr
ham,want lick pussy
ham,u made appointment
spam,enjoy jamster videosound gold club credits 2 new get fun help call 09701213186
ham,yeah thought lem know anything goin later
spam,urgent trying contact last weekends draw shows prize guaranteed call claim code s89 valid 12hrs
