category,processed_message
spam,goal arsenal 4 henry 7 v liverpool 2 henry scores simple shot 6 yards pass bergkamp give arsenal 2 goal margin 78 mins
ham,said gon na snow start around 8 9 pm tonite predicting inch accumulation
ham,aah bless arm
ham,oh come tomorrow
ham,happening gotten job begun registration permanent residency
ham,quite ok bit ex u better go eat smth else feel guilty
spam,want new video phone 600 anytime network mins 400 inclusive video calls downloads 5 per week free deltomorrow call 08002888812 reply
ham,dont want hear anything
ham,hi kate u give ring asap xxx
ham,account refilled successfully inr lt decimal gt keralacircle prepaid account balance rs lt decimal gt transaction id kr lt gt
ham,pls give food preferably pap slowly loads sugar take hour give water slowly
ham,means still think teju
spam,free 1st week no1 nokia tone 4 ur mobile every week txt nokia 8077 get txting tell ur mates pobox 36504 w45wq
ham,hey next sun 1030 basic yoga course bugis go pilates intro next sat tell time r free
spam,1 new message please call 08718738034
ham,told coming wednesday
ham,eatin lunch
ham,da birthdate certificate april real date today dont publish shall give special treat keep secret way thanks wishes
spam,send logo 2 ur lover 2 names joined heart txt love name1 name2 mobno eg love adam eve 07123456789 87077 yahoo pobox36504w45wq txtno 4 ads 150p
spam,get 3 lions england tone reply lionm 4 mono lionp 4 poly 4 go 2 original n best tones 3gbp network operator rates apply
ham,tot u reach liao said
ham,u u 2 u b moving flat cos need arrange pick lamp etc take care hello caroline
ham,weird know one point
spam,chance win free bluetooth headset simply reply back adp
ham,dai da send resume id
spam,donate unicef asian tsunami disaster support fund texting donate 864233 added next bill
ham,ummmmmaah many many happy returns day dear sweet heart happy birthday dear
ham,money issue weigh thanks breathe easier make sure dont regret thanks
ham,watching surya movie 6 pm vijay movie pokkiri
ham,toshiba portege m100 gd
ham,ok lor wat time ü finish
spam,want 2 get laid tonight want real dogging locations sent direct 2 ur mob join uk largest dogging network txting moan 69888nyt ec2a 150p
spam,dating two started sent text talk sport radio last week connection think coincidence
ham,whats coming hill monster hope great day things r going fine busy though
ham,sometimes put walls around hearts safe getting hurt find cares enough break walls amp get closer goodnoon
ham,nothing much chillin home super bowl plan
ham,hope result consistently intelligent kind start asking practicum links keep ears open best ttyl
ham,need drug anymore
spam,sms ac sptv new jersey devils detroit red wings play ice hockey correct incorrect end reply end sptv
ham,shall come get pickle
ham,hi always online yahoo would like chat someday
ham,buy blackberry bold 2 torch buy new used let know plus saying buy lt gt g wifi ipad saying lt gt g
ham,got c lazy type forgot ü lect saw pouch like v nice
ham,kinda first one gets twelve aah speak tomo
spam,free camera phones linerental 750 cross ntwk mins price txt bundle deals also avble call 08001950382 mf
ham,yup song bro creative neva test quality said check review online
ham,gorgeous keep pix cumming thank
ham,hope good week checking
ham,dear chechi talk
ham,get step 2 outta way congrats
ham,thinking chuckin ur red green n black trainners 2 save carryin bac train
ham,den wat e schedule b lk sun
ham,nice new shirts thing wear nudist themed mu
ham,point hangin mr right makin u happy
ham,hey free call
ham,u wearing
ham,aslamalaikkum insha allah tohar beeen muht albi mufti mahfuuz meaning
spam,someone u know asked dating service 2 contact cant guess call 09058091854 revealed po box385 m6 6wu
ham,u lunch alone bored
ham,u town alone
spam,call 09095350301 send girls erotic ecstacy stop texts call 08712460324 nat rate
ham,love come took long leave zaher got words ym happy see sad left miss
ham,yeah got one lined us
ham,really skateboarding despite fact gets thrown winds bandages shit arms every five minutes
ham,ok
ham,mind ask happened dont say uncomfortable
ham,maybe pressies
ham,honeybee said sweetest world god laughed amp said wait u havnt met person reading msg moral even god crack jokes
ham,got meh
ham,otherwise part time job
ham,catches put
spam,brand new mobile music service live free music player arrive shortly install phone browse content top artists
ham,sorry took long omw
ham,lol grr mom taking forever prescription pharmacy like 2 minutes away ugh
ham,de looking good
ham,thk 50 shd ok said plus minus 10 ü leave line paragraphs
ham,uncle g checking rewarding month
ham,working
ham,good stuff
spam,sports fans get latest sports news str 2 ur mobile 1 wk free plus free tone txt sport 8007 norm
ham,thinkin someone good drugs
ham,today going college able atten class
ham,badrith chennai surely pick us competition
ham,haha yeah 2 oz kind shitload
ham,reassuring crazy world
ham,maybe say hi find got card great escape wetherspoons
ham,gon na blake night might able get little early
ham,one good partnership going take lead
ham,oh getting even u u
ham,get hep b immunisation nigeria
ham,watching house entertaining getting whole hugh laurie thing even stick indeed especially stick
ham,imagine finally get sink bath put paces maybe even eat left also imagine feel cage cock surrounded bath water reminding always owns enjoy cuck
spam,ur currently 500 pounds maximize ur send cash 86688 cc 08718720201 po box
ham,nice line said broken plz cum 1 times infront wise trust u good 9t
ham,sorry never hear unless book one kinda joke thet really looking skinny white girls one line much camera something like casting look
ham,sorry call later
ham,dear know lt gt th lt gt th birthday loving gopalettan planning give small gift day like participate welcome please contact admin team details
ham,wewa iriver 128 mb
ham,lt gt ish minutes 5 minutes ago wtf
ham,eat fo lunch senor
ham,dunno lei ü decide lor abt leona oops tot ben going n msg
ham,prakesh know
ham,much cost approx per month
spam,free message activate 500 free text messages replying message word free terms conditions visit
ham,hi yijue regarding 3230 textbook intro algorithms second edition selling 50
ham,problem baby good time talk called left message
ham,guys
ham,time think need know near campus
ham,ok great thanx lot
ham,download clear movies dvd copies
ham,thanks understanding trying tell sura
spam,urgent 1 week free membership prize jackpot txt word claim 81010 c lccltd pobox 4403ldnw1a7rw18
ham,maybe westshore hyde park village place near house
spam,dear voucher holder next meal us use following link pc 2 enjoy 2 4 1 dining experiencehttp
ham,gr8 handle victoria island traffic plus album due
ham,even friend priest call
spam,customer service annoncement new years delivery waiting please call 07046744435 arrange delivery
ham,thanx 4 2day u r goodmate think ur rite sary asusual 1 u cheered love u franyxxxxx
ham,advance happy pongal
ham,huh fast dat means u havent finished painting
ham,buy
ham,battery mr adewale uncle aka egbon
ham,watching telugu movie wat abt u
ham,said kiss kiss ca sound effects gorgeous man kind person needs smile brighten day
ham,yes appt
ham,yar wanted 2 scold u yest late already got zhong se qing u ask b4 ask go w u lor n u still act real
ham,ok wont call disturb one know avoiding burden
ham,watching ajith film ah
spam,today offer claim ur worth discount vouchers text yes 85023 savamob member offers mobile cs 08717898035 sub 16 unsub reply x
ham,watching tv got new job
spam,heard u4 call 4 rude chat private line 01223585334 cum wan 2c pics gettin shagged text pix 8552 2end send stop 8552 sam xxx
ham,one week leave put know time
ham,borrow ur bag ok
ham,e timing go w u lor
ham,sad story man last week wife wish parents forgot n kids went work even colleagues wish entered cabin pa said happy boss felt special askd 4 lunch lunch invited apartment went said u mind go bedroom minute ok sed sexy mood came 5 minuts latr wid cake n wife parents kidz friends n colleagues screaming surprise waiting sofa naked
ham,meeting ü rite go home lor ü dun feel like comin ok
ham,love excited day spend make happy
ham,shb b ok lor thanx
ham,want bold 2 bb torch
spam,private 2004 account statement 07742676969 shows 786 unredeemed bonus points claim call 08719180248 identifier code 45239 expires
ham,also sorta blown couple times recently id rather text blue looking weed
ham,anything
ham,hello boytoy geeee missing today like send tm remind thinking loved loving kiss
ham,oh howda gud gud mathe en samachara chikku
ham,r u meeting da ge nite tmr
ham,dear got bus directly calicut
ham,c u
ham,training manual show tech process password reset troubleshooting
spam,dear u invited xchat final attempt contact u txt chat 86688
spam,1 polyphonic tone 4 ur mob every week txt pt2 87575 1st tone free get txtin tell ur friends 16 reply hl 4info
spam,guess first time created web page read wrote waiting opinions want friend
ham,gud mrng dear hav nice day
ham,love brother time talk english grins say hey muhommad penny says hello across sea
ham,oh icic k lor den meet day
ham,smith waste wan na gayle
ham,case wake wondering forgot take care something grandma today done parade
ham,blankets sufficient thx
ham,oh k k big good
ham,kindly send one flat lt decimal gt today
ham,dont gim lip caveboy
ham,lay man let know missed thought great day send bimbo ugo numbers ill appreciate safe
ham,running managed 5 minutes needed oxygen might resort roller option
ham,anything lor go go lor
ham,slept
ham,nw came hme da
ham,hey veggie pizza
ham,hey told name gautham ah
ham,jesus armand really trying tell everybody find
ham,already got flaky parent supposed child job support parent ride age anyway supposed support hurt unintentional hurt nonetheless
ham,office call lt gt min
spam,boltblue tones 150p reply poly mono eg poly3 cha cha slide yeah slow jamz toxic come stop 4 tones txt
ham,haha first person gon na ask
ham,back good journey let know need receipts shall tell like pendent
ham,dunno jus say go lido time 930
ham,sign maturity start saying big things actually start understanding small things nice evening bslvyl
ham,cocksuckers makes feel better ipads worthless garbage novelty items feel bad even wanting one
ham,thank say happy onam fine remembered met insurance qatar insha ex tata aig joined tissco tayseer
ham,well still bit left guys want tonight
ham,unfortunately found pick sister airport evening think going try go one th
ham,ball moving spin last difficult bat
spam,mobile 10 mths update latest phones free keep ur number get extra free text yes call
ham,wish things different wonder able show much value pls continue brisk walks drugs without askin please find things laugh love dearly
ham,haf combine n c lor
spam,double mins txts 4 6months free bluetooth orange available sony nokia motorola phones call mobileupd8 08000839402
ham,pathaya enketa maraikara pa
ham,hey chief give bell get need talk royal visit 1st june
ham,much r ü willing pay
ham,woke yeesh late fall asleep til lt gt
ham,reached home tired come tomorro
ham,jus ans lar u noe later
ham,okey dokey swashbuckling stuff oh
spam,tddnewsletter games thedailydraw dear helen dozens free games great prizeswith
ham,message text missing sender name missing number missing sent date missing missing u lot thats everything missing sent via
ham,tuition hm go 1120 1205 one mind
ham,wat da model num ur phone
ham,otherwise part time job
ham,yeah would leave hour least 4 sound
spam,camera awarded sipix digital camera call 09061221066 fromm landline delivery within 28 days
ham,yupz oredi booked slots 4 weekends liao
ham,yeah got 2 v apologetic n fallen actin like spoilt child got caught till 2 wo go badly cheers
ham,get opinion something first
ham,god picked flower dippeditinadew lovingly touched itwhichturnedinto u gifted tomeandsaid friend 4u
spam,146tf150p
ham,hey almost forgot happy babe love ya
ham,think mentor 100 percent sure
ham,wont b trying 2 sort house ok
ham,started searching get job great potential talent
ham,pass dis ur contacts n see wat u get red luv wid blue u put smile face purple u r realy hot pink u r swt orange thnk lyk green realy wana go wid yelow wnt u bck black jealous brown miss nw plz giv one color
ham,late said website dont slippers
ham,sent lt gt bucks
spam,nokia 7250i get win free auction take part send nokia 86021
ham,working
ham,knew time murder exactly
ham,night worrying appt shame missed girls night quizzes popcorn hair
ham,much getting
ham,package programs well
ham,tel software name
spam,new local dates area lots new people registered area reply date start 18 replys150
spam,guaranteed award even cashto claim ur award call free 08000407165 2 stop getstop 88222 php
ham,gon na let know cos comes bak holiday day coming number
ham,good afternoon babe goes day job prospects yet miss love sighs
ham,cute thought friendship necessary share every secret ur close frnd watever u shared true
spam,know u u know send chat 86688 let find rcvd ldn 18 years
ham,hello site download songs urgent pls
ham,decided people care stuff vote caring stuff losers
ham,know dat feelin pete wuld get em nuther place nuther time mayb
ham,anyway seriously hit back otherwise light armand always shit vomiting
ham,purity friendship two smiling reading forwarded message smiling seeing name gud evng
ham,r u scratching
spam,currently message awaiting collection collect message call 08718723815
ham,yup izzit still raining heavily cos e mrt ca c outside
ham,ho ho big belly laugh see ya tomo
ham,call check life begin qatar pls pray hard
spam,free video camera phones half price line rental 12 mths 500 cross ntwk mins 100 txts call mobileupd8 08001950382
ham,necessarily expect done get back though headin
ham,yes dont care need bad princess
ham,wonderful okors great month cherish guys wish well day mojibiola
spam,camera awarded sipix digital camera call 09061221066 fromm landline delivery within 28 days
ham,babe fucking love know fuck good hear voice need crave ca get enough adore ahmad kisses
ham,thk em find wtc far weiyi goin e rest dunno yet r ur goin 4 dinner den might b able join
ham,aight fuck get later
ham,ok lor msg b4 u call
ham,went ur hon lab one
ham,ca right second got ta hit people first
ham,dunno lei thk mum lazy go neva ask yet
ham,sent jd customer service cum accounts executive ur mail id details contact us
ham,want inside every night
ham,argh fuck nobody town
ham,going sao mu today done 12
spam,text82228 get ringtones logos games questions info
ham,u noe wat time e place dat sells 4d closes
spam,registered optin subscriber ur draw 4 gift voucher entered receipt correct ans 80062 whats no1 bbc charts
ham,id onluy matters getting offcampus
ham,available soiree june 3rd
spam,1 new message please call 08712400200
ham,aight work thanks
ham,dont understand message
ham,problem
ham,sorry missed babe late slept hope enjoy driving lesson boytoy miss teasing kiss
ham,got new year cos yetunde said wanted surprise didnt see money returned mid january lt gt day return period ended
ham,aiyah sorry lor watch tv watch forgot 2 check phone
ham,forgot 2 ask ü smth card da present lei ü want 2 write smth sign
ham,happy valentines day advance
ham,detroit home snow enjoy
ham,going bath msg next lt gt min
ham,hello good week fancy drink something later
ham,smile pleasure smile pain smile trouble pours like rain smile sum1 hurts u smile becoz someone still loves see u smiling
ham,mu like lt gt seconds
ham,hello news job making wait fifth week yeah im woozles weasels exeter still home 3
ham,took hooch walk toaday fell splat grazed knees everything stayed home see tomorrow
ham,see prolly yeah
ham,carlos took leave minute
ham,yar lor keep raining non stop u wan 2 go elsewhere
ham,whatever juliana whatever want
ham,thanks bomb date phone wanted say
ham,ü v fan
ham,promises though even gotten dinner yet
ham,nice day today love dearly
ham,said look pretty wif long hair wat thk cutting quite short 4 leh
ham,ok said got wisdom teeth hidden inside n mayb need 2 remove
ham,hello handsome finding job lazy working towards getting back net mummy boytoy miss
ham,good morning dear shijutta great amp successful day
ham,party place usf charge contribute way greatly appreciated yeah got room one
ham,came hostel going sleep plz call class hrishi
ham,much buzy
ham,k k good study well
ham,pride almost lt gt years old takin money kid supposed deal stuff grownup stuff tell
ham,end might still vomit okay everything come
ham,ok would b lovely u r sure think wot u want drinkin dancin eatin cinema u wot
ham,motivate behind every darkness shining light waiting find behind every best friend always trust love bslvyl
ham,thts god gift birds humans hav natural gift frm god
ham,boytoy miss happened
ham,height recycling read people spend time earning money money spent spending time good morning keep smiling
ham,night ended another day morning come special way may smile like sunny rays leaves worries blue blue bay gud mrng
ham,work ah den 6 plus lor u workin oso rite den go orchard lor place go liao
ham,fighting world easy u either win lose bt fightng some1 close u dificult u lose u lose u win u still lose
ham,think still car
ham,pls call da happen
spam,contract mobile 11 mnths latest motorola nokia etc free double mins text orange tariffs text yes callback remove records
ham,hey want anything buy
ham,anything specific regards jaklin idk fuck
ham,good night going sleep
ham,u love someone dont make love u much u love much dont want loved anyone except gud nit
ham,pls needs dat slowly vomit
ham,yo call get chance friend mine wanted ask big order
ham,noe la u wana pei bf oso rite k lor days den
ham,found way get another app phone eh go net cafe take job geeee need babe crave see
ham,cool like swimming pool jacuzzi house
ham,usually take fifteen fucking minutes respond yes question
ham,tirupur call da
ham,bluray player
ham,feel real valentine yo valentine even tho u hardly play
ham,anything lor coming
spam,reply win weekly 2006 fifa world cup held send stop 87239 end service
ham,many people seems special first sight remain special till last sight maintain till life ends sh jas
ham,nobody decide eat dad wants chinese
ham,hello sort town already dont rush home eating nachos let know eta
ham,leaving qatar tonite search went add ur prayers
spam,gr8 new service live sex video chat mob see sexiest dirtiest girls live ur phone 4 details text horny 89070 cancel send stop 89070
ham,like italian food
ham,k give back thanks
ham,fine give call knows wants questions
ham,adult would learn experience real danger dont like peeps using drugs dont need comment
ham,many times told stage use laugh listen aha
ham,k leaving soon little 9
ham,huh early ü dinner outside izzit
ham,yo howz u girls never rang india l
ham,meet lobby
spam,simpsons movie released july 2007 name band died start film day day day send b c
spam,hi sue 20 years old work lapdancer love sex text live bedroom text sue textoperator g2 1da 150ppmsg
ham,forced eat slice really hungry tho sucks mark getting worried knows sick turn pizza lol
ham,full heat pa applyed oil pa
ham,scotland hope showing jjc tendencies take care live dream
ham,small problem auction punj asking tiwary
ham,simple arithmetic percentages
spam,gsoh good spam ladies u could b male gigolo 2 join uk fastest growing mens club reply oncall mjzgroup reply stop msg
ham,know wot people wear shirts jumpers hat belt know r cribbs
ham,haha awesome minute
ham,leaving house
ham,sent ur email id soon
ham,life strict teacher bcoz teacher teaches lesson amp conducts exam life first conducts exam amp teaches lessons happy morning
ham,u ever get song stuck head reason wo go away til u listen like 5 times
ham,haha mayb u rite u know well da feeling liked someone gd lor u faster go find one gals group attached liao
ham,ü give time walk
ham,taking derek amp taylor walmart back time done leave mouse desk text priscilla ready
ham,u workin overtime nigpun
ham,meeting u work tel shall work tomorrow
ham,ü b going esplanade fr home
ham,ya nice ready thursday
ham,dunno wat get 4
ham,theoretically yeah could able come
ham,make lasagna vodka
ham,got divorce lol
ham,lover need
spam,07801543489 guaranteed latests nokia phone 40gb ipod mp3 player prize txt word collect
ham,dad says hurry hell
ham,love want flood pretty pussy cum
ham,ok lar u sleep early nite
ham,thats cool day
ham,pls pls send mail know relatives coming deliver know costs risks benefits anything else thanks
ham,howz persons story
spam,thanks ringtone order reference t91 charged gbp 4 per week unsubscribe anytime calling customer services 09057039994
ham,movie call 4 wat
spam,5p 4 alfie moon children need song ur mob tell ur m8s txt tone charity 8007 nokias poly charity polys zed 08701417012 profit 2 charity
ham,sad story man last week wife wish parents forgot n kids went work even colleagues wish
ham,ok tell stay yeah tough optimistic things improve month
ham,wuld without baby thought alone mite break wan na go crazy everyboy needs lady xxxxxxxx
ham,willing go aptitude class
ham,yes nigh cant aha
ham,hi mom might back later lt gt
ham,please come imin urgoin outl8r reallyneed dontplease dontignore mycalls u thecd tome 4 2moro
spam,mobile 10 mths update latest orange phones free save free calls text yes callback orno opt
ham,alex says ok ok
ham,haha money leh later got go tuition haha looking empty slots driving lessons
ham,sir hope day going smoothly really hoped wont bother bills ca settle month extra cash know challenging time also let know
ham,neither sterm voice studying fine sure thing resolved tho anyway fab hols
ham,way
ham,stop old man get build snowman snow angels snowball fights
ham,many things antibiotic used chest abdomen gynae infections even bone infections
ham,da good good unsold
ham,fyi usf swing room whenever
ham,agree stop thinkin ipad please ask macho question
ham,yar tot u knew dis would happen long ago already
ham,shall call dear food
ham,friends use call
ham,hope ur head hurt 2 much ploughing way pile ironing staying chinky tonight come round like
ham,ya telling abt tht incident
ham,ok lor thanx ü school
ham,amazing quote sometimes life difficult decide whats wrong lie brings smile truth brings tear
ham,jus came back fr lunch wif sis u leh
ham,posible dnt live lt gt century cm frwd n thnk different
spam,congrats 1 year special cinema pass 2 call 09061209465 c suprman v matrix3 starwars3 etc 4 free 150pm dont miss
ham,whatsup dont u want sleep
ham,hi mobile lt gt added contact list great place send free sms people visit
ham,awesome question cute answer someone asked boy ur life smiled amp answered fine gudnite
ham,aiyo bit pai seh ü noe scared dun rem die hee become better lookin oredi leh
ham,wish
ham,got looks scrumptious daddy wants eat night long
spam,life never much fun great came made truly special wo forget enjoy one
ham,shopping eh ger toking abt syd leh haha
ham,reach office around lt decimal gt amp mobile problem get voice call asa free
ham,got xmas radio times get
ham,nope still market
ham,opinion jada kusruthi lovable silent spl character matured stylish simple pls reply
spam,free2day sexy st george day pic jordan txt pic 89080 dont miss every wk saucy celeb 4 pics c 0870241182716
ham,good making money
spam,thank winner notified sms good luck future marketing reply stop 84122 customer services 08450542832
ham,training tomorrow
ham,u wake already thanx 4 e tau sar piah quite nice
ham,dare change ring
ham,wen u miss someone person definitely special u person special miss gdeve
ham,meet corporation st outside gap see mind working
ham,freezing home yet remember kiss mom morning love think missing yet
ham,hi dear saw dear happy battery low
ham,emailed yifeng part oredi ü get fr
ham,tunde wishing great day abiola
ham,finish already yar keep saying mushy embarrassed ok
ham,u guys never invite anywhere
ham,fffff text kadeem far gone
ham,dont know supports ass srt thnk think ps3 play usb
ham,dunno da next show aft 6 toa payoh got 650
ham,eaten day sitting staring juicy pizza ca eat meds ruining life
ham,doesnt make sense take unless free need know
ham,bring got
ham,say god love amp need clean heart ten special people amp u c miracle tomorrow pls pls
ham,gud mrng dear hav nice day
ham,g wants know fuck
ham,office whats matter msg call break
ham,confirm eating esplanade
ham,lt gt fast approaching wish u happy new year happy sankranti happy republic day happy valentines day happy shivratri happy ugadi happy fools day happy may day happy independence day happy friendship mother father teachers childrens day amp happy birthday 4 happy ganesh festival happy dasara happy diwali happy christmas lt gt good mornings afternoons evenings nights rememberi first wishing u raj
spam,free unlimited hardcore porn direct 2 mobile txt porn 69200 get free access 24 hrs chrgd 50p per day txt stop 2exit msg free
ham,happy new year princess
ham,uncle abbey happy new year abiola
ham,rude campus
ham,time thinkin goin
ham,planning usually stops find hella weed smoke hella weed
ham,entered cabin pa said happy boss felt special askd 4 lunch lunch invited apartment went
spam,ur currently 500 pounds maximize ur send go 86688 cc 08718720201
ham,alright took morphine back yo
ham,ryder gibbs
ham,lil fever fine
ham,wish great semester
spam,u nokia 6230 plus free digital camera u get u win free auction take part send nokia 83383 16
ham,aiyah u ok already lar e nydc wheellock
ham,tired arguing week week want
spam,wow boys r back take 2007 uk tour win vip tickets vip club txt club trackmarque ltd info vipclub4u
ham,thanks sending mental ability question
ham,parents kidz friends n colleagues screaming surprise waiting sofa naked
ham,fujitsu series lifebook good
spam,moby pub high street prize u know new duchess cornwall txt first name stop 008704050406 sp arrow
ham,done internet connection v slow send try later first thing tomo
