category,processed_message
ham,hi babe im home wan na something xx
ham,dear regret cudnt pick frm ctla cochin mobile car ente style ishtamayoo happy bakrid
ham,yeah thinking
ham,calls messages missed calls
ham,hey pay salary de lt gt
ham,call like lt gt times oh give us hypertension oh
ham,dont search love let love find thats called falling love bcoz u dont force u fall u know smeone hold u bslvyl
ham,pick ur fone u dumb
ham,lol grins babe thanks thinking
ham,headin towards busetop
ham,thanks lovely wisheds rock
ham,ok
spam,want 2 get laid tonight want real dogging locations sent direct 2 ur mob join uk largest dogging network bt txting gravel 69888 nt ec2a 150p
ham,networking job
ham,yeah barely enough room two us x many fucking shoes sorry man see later
ham,good morning princess
ham,thinking lifting one
ham,oh yes speak txt 2 u hmm u get email
ham,sister kids
ham,yes princess toledo
ham,hey going lo lesson gym
ham,call see facebook huh
ham,tell rob mack gf theater
ham,dear ok
ham,would great guild could meet bristol road somewhere get touch weekend plans take flight good week
ham,ca describe lucky actually awake noon
ham,cant pick phone right pls send message
ham,jus hope true missin cos really missin done anything feel guilty yet
ham,yes started send requests make pain came back back bed double coins factory got ta cash nitros
spam,important customer service announcement call freephone 0800 542 0825
ham,missionary hook doggy hook standing
ham,k wait chikku il send aftr lt gt mins
ham,ya nice ready thursday
ham,ah well confuses things doesnt thought friends maybe wrong thing already sort invited may come cos money
ham,also didnt get na hi hi hi hi hi
ham,ur luck love someone ur fortune love one loves miracle love person ca love anyone except u gud nyt
ham,wont touch permission
ham,hope scared
spam,cds 4u congratulations ur awarded cd gift vouchers gift guaranteed freeentry 2 wkly draw xt music 87066 tncs
ham,yup already thanx 4 printing n handing
ham,apart one told yesterday
ham,cool come havent wined dined
ham,way send shade stuff wonderful
ham,means fat head
ham,mobile sms ur mail regards achan
ham,able kids want kids one day
spam,dear matthew please call 09063440451 landline complimentary 4 lux tenerife holiday cash await collection ppm150 sae cs box334 sk38xh
ham,stop knowing well
spam,free entry 2 weekly comp chance win ipod txt pod 80182 get entry std txt rate c apply 08452810073 details
ham,huh 6 also many mistakes
ham,dare stupid wont tell anything hear wont talk
ham,made eta taunton planned hope still okday good see
ham,wait 4 ü inside da car park
ham,dhoni luck win big win
ham,ur paper
ham,cause freaky lol
ham,got smaller capacity one quite ex
ham,u download fring app
spam,sunshine quiz wkly q win top sony dvd player u know country liverpool played mid week txt ansr 82277 sp tyrone
ham,nothing got msg frm tht unknown
ham,eh den sat u book e kb liao huh
ham,yeah like goes like friends imma flip shit like half hour
ham,wake lt gt morning
ham,wylie update weed dealer carlos went freedom class lunsford
ham,2 celebrate else
ham,oh sorry please
ham,also remember get dobby bowl car
ham,yup ok go home look timings msg ü xuhui going learn 2nd may lesson 8am
ham,cant pick phone right pls send message
ham,sorry da gone mad many pending works
ham,buy one egg da please
ham,r meeting
spam,lord rings return king store reply lotr 2 june 4 chance 2 win lotr soundtrack cds stdtxtrate reply stop end txts
ham,live next lt gt mins
ham,dear reached railway happen
spam,urgent mobile number awarded prize guaranteed call 09058094455 land line claim valid 12hrs
ham,purity friendship two smiling reading forwarded message smiling seeing name gud evng musthu
spam,think ur smart win week weekly quiz text play 85222 cs winnersclub po box 84 m26 3uz
spam,bank granite issues explosive pick members 300 nasdaq symbol cdgt per
ham,ok whats ur todays plan
ham,need coz never go
ham,brother transfered lt gt lt gt pa
ham,ok msg u b4 leave house
ham,way ur home
ham,merry christmas u annie
ham,tell pain de
ham,oh yeah hav great time postcard 1 look girls im gone u know 1im talkin bout xx
ham,back lem know ready
ham,usual iam fine happy amp well
spam,tells u 2 call 09066358152 claim prize u 2 enter ur mobile personal details prompts careful
spam,b floppy b snappy happy gay chat service photo upload call 08718730666 2 stop texts call 08712460324
spam,3 free tarot texts find love life try 3 free text chance 85555 16 3 free msgs
ham,ranjith cal drpd deeraj deepak 5min hold
ham,like hotel dusk game think solve puzzles area thing
ham,got arrested possession shit lt time gt pm
ham,26th july
ham,dropped em omw back
ham,hey rite u put 10 evey mnth
ham,ugh ca u apologize admit u wrong ask take u back
spam,88066 88066 lost 3pound help
ham,class lt gt reunion
ham,got seventeen pounds seven hundred ml hope ok
ham,eek lot time especially since american pie like 8 minutes long ca stop singing
ham,u come n search tat vid finishd
ham,1 cbe 2 chennai
ham,nan sonathaya soladha boss
ham,siva hostel aha
ham,sure get acknowledgement astoundingly tactless generally faggy demand blood oath fo
ham,sure make sure knows ai smokin yet
ham,actually send reminder today wonderful weekend
ham,yep like pink furniture tho
ham,reached already
ham,k deleted contact
ham,free day finish 6 mon n thurs
ham,hui xin da lib
ham,awake oh
spam,oh god found number glad text back xafter msgs cst std ntwk chg
ham,lol forgot eh yes bring babe
ham,po de need job aha
ham,gumby special lt gt cheese pizza 2 know doin tonight
ham,sorry roommates took forever ok come
ham,thanks reply today ur visa coming r u still buying gucci bags sister things easy uncle john also bills really need think make money later sha
ham,ya came ago
ham,machan go gym tomorrow wil come late goodnight
ham,walked moms right stagwood pass right winterstone left victors hill address lt gt
ham,new years eve went party boyfriend si hey
ham,time come tomorrow
ham,well slightly disastrous class pm fav darlings hope day coffee wld good ca stay late tomorrow time place always
ham,masters buy bb cos sale bf
ham,also hi wesley
spam,valentines day special win quiz take partner trip lifetime send go 83600 rcvd
ham,k yan jiu liao sat go 4 bugis vill one frm 10 3 den hop parco 4 nb sun go cine frm 1030 2 den hop orc mrt 4 hip hop 4
ham,thanx birthday already
ham,lolnice went fish water
ham,left dessert u wan 2 go suntec look 4 u
ham,happy saying
ham,ok da already planned wil pick
spam,loans purpose even bad credit tenants welcome call 08717111821
spam,ur ringtone service changed 25 free credits go choose content stop txt club stop 87070 club4 po box1146 mk45 2wt
ham,many buy
ham,monday next week give full gist
spam,welcome msg free giving free calling future mgs billed 150p daily cancel send go stop 89123
ham,buzz hey love think hope day goes well sleep miss babe long moment together loving smile
ham,lets make saturday monday per convenience
ham,dear mood cant drive brother drive
ham,gon na home soon want talk stuff anymore tonight k cried enough today
ham,let snow let snow kind weather brings ppl together friendships grow
ham,add really care ca least get dude fuck hey money want
ham,ask say please message
ham,apo mokka players
ham,nokia phone lovly
ham,hi im relaxing time ever get 7am every day party good night get home tomorrow 5ish
ham,aight sounds good want come
ham,k k give treat
ham,gettin bit arty collages mo well tryin 2 ne way got roast min lovely shall enjoy
ham,surfing online store offers want buy thing
ham,keeping away like
ham,yay finally lol missed cinema trip last week
spam,stop bootydelious inviting friend reply see stop send stop frnd 62468
ham,haha yup hopefully lose kg mon hip hop go orchard weigh
ham,prabha soryda realy frm heart sory
ham,india going draw series many years south african soil
spam,urgent trying contact u todays draw shows prize guaranteed call 09050000460 land line claim j89 po box245c2150pm
ham,supposed wake gt
ham,common hearin r u wat r u ur day let ask u something different u smile today gud evng
ham,ok tell half hr b4 u come need 2 prepare
ham,interested like
ham,vote wherever heart guides
ham,
spam,free 1st week no1 nokia tone 4 ur mob every week txt nokia 8007 get txting tell ur mates pobox 36504 w45wq
ham,come back tampa ffffuuuuuuu
ham,well pattern emerging friends telling drive come smoke telling weed smoke things see hesitant
ham,tessy pls favor pls convey birthday wishes nimya pls dnt forget today birthday shijas
ham,cos daddy arranging time c wat time fetch ü mah
spam,eastenders tv quiz flower dot compare violet tulip lily txt e f 84025 4 chance 2 win cash
ham,mum ask ü buy food home
ham,er yep sure props
ham,cool text parked
ham,cant think anyone spare room top head
ham,didnt get anything da
ham,possible
ham,4 oclock mine bash flat plan
ham,every king crying baby every great building map imprtant u r today u wil reach tomorw gud ni8
spam,congratulations thanks good friend u xmas prize 2 claim easy call 08718726971 10p per minute
spam,2p per min call germany 08448350055 bt line 2p per min check info c text stop opt
ham,listened2the plaid gd new air1 abel u hav2hear c u sn xxxx
ham,ok ill send lt decimal gt ok
ham,replying boye changed phone number
ham,time prob 3
ham,u talking
ham,wow right mean guess gave boston men changed search location nyc something changed cuz signin page still says boston
ham,mm kanji dont eat anything heavy ok
ham,bishan lar nearer need buy early cos buy got ta park car
ham,shall start hear
spam,please call customer service representative 0800 169 6031 guaranteed cash prize
ham,aiyah ok wat long got improve already wat
ham,call da waiting call
ham,oh k placement ah
ham,glad talking
ham,ummmmmaah many many happy returns day dear sweet heart happy birthday dear
ham,watching tv got new job
ham,like made throw smoking friend car one time awesome
ham,waqt se pehle naseeb se zyada kisi ko kuch nahi milta zindgi wo nahi jo hum sochte hai zindgi wo hai jo ham jeetey hai
ham,hey booked 2 lessons sun liao
ham,especially since talk boston personal statement lol woulda changed realized said nyc says boston
ham,crucify c told earlier
ham,searching right words thank breather promise wont take help granted fulfil promise wonderful blessing times
ham,laptop take
ham,hey reply pa
ham,lol mad first woke gave
ham,fair enough anything going
ham,babe lost try rebooting
ham,give us back id proof lt gt rs wont allow work come home within days
ham,yes baby need stretch open pussy
ham,okay soon best
spam,congrats 1 year special cinema pass 2 call 09061209465 c suprman v matrix3 starwars3 etc 4 free 150pm dont miss
ham,sorry battery died yeah
ham,alright see bit
ham,sorry ca text amp drive coherently see twenty
ham,dad gon na call gets work ask crazy questions
ham,tell bad character u dnt lik try change lt gt add tat 2 new year resolution waiting ur frank good morning
spam,please call 08712402902 immediately urgent message waiting
ham,tension ah machi problem
ham,lol different go trying find every real life photo ever took
spam,freemsg txt call 86888 claim reward 3 hours talk time use phone inc 3hrs 16 stop txtstop
ham,sending greetings joy happiness gr8 evening
ham,poor girl ca go one day lmao
ham,came look flat seems ok 50s away alot wiv work got woman coming
spam,sms auction brand new nokia 7250 4 auction today auction free 2 join take part txt nokia 86021
ham,late need go n get da laptop
spam,tone club subs expired 2 reply monoc 4 monos polyc 4 polys 1 weekly 150p per week txt stop 2 stop msg free stream 0871212025016
ham,use foreign stamps whatever send
ham,right brah see later
ham,know friend already told
ham,call times job today ok umma ask speed
spam,important customer service announcement call freephone 0800 542 0825
ham,cool text ready
ham,made day great day
ham,thank much selflessness love plenty
ham,love holiday monday feeling even go dentists hour
ham,enjoy urself tmr
ham,hiya u paying money account thanks got pleasant surprise checked balance c get statements 4 acc
ham,well balls time make calls
ham,dear relieved westonzoyland going plan end
ham,jason says cool pick place like hour
ham,thats cool sometimes slow gentle sonetimes rough hard
ham,mmmmm sooooo good wake words morning love mmmm fuck love lion devouring kiss across sea
ham,please leave topic sorry telling
ham,know jack shit anything something helpful want pretend text whatever response hypotheticalhuagauahahuagahyuhagga
spam,urgent 2nd attempt contact prize yesterday still awaiting collection claim call 09061702893
ham,fps
ham,actually mobile full msg work online need send lt gt sent msg wil explain u later
ham,please ask macho price range want something new used plus interfued blackberry bold lt gt bb
ham,nothing jus tot u would ask cos u ba gua went mt faber yest yest jus went already mah today going jus call lor
ham,yes trust u buy new stuff asap try
ham,u sending home first ok lor ready yet
ham,yes tv always available work place
ham,anyways go gym whatever love smiles hope ok good day babe miss much already
ham,imagine life without see fast u searching worry l always disturb u goodnoon
ham,ok
ham,got room soon put clocks back til 8 shouted everyone get realised wahay another hour bed
ham,gon na go get tacos
ham,either way works lt gt years old hope doesnt bother
ham,sorry uncle keep touch
ham,hey whats u sleeping morning
ham,meet ü 5 4 depends ü wan 2 lor
ham,babe miiiiiiissssssssss need crave geeee sad without babe love
ham,wrong phone phone answer one assume people well
ham,oh way food fridge want go meal tonight
ham,great shoot big loads get ready
ham,cool want go kappa meet outside mu
ham,yo game almost want go walmart soon
ham,mostly like
ham,working ringing u thing whole houseful screaming brats pulling hair loving u
ham,im done studyn library
ham,haha got fast lose weight thk muz go 4 month den got effect gee later go aust put bk e weight
ham,lol boo hoping laugh
spam,get 3 lions england tone reply lionm 4 mono lionp 4 poly 4 go 2 original n best tones 3gbp network operator rates apply
ham,buying today ü need c meh
ham,sun ah thk mayb dun anythin thk book e lesson e pilates orchard mrt u noe hor
ham,olol printed forum post guy exact prob fixed gpu replacement hopefully dont ignore
ham,ok prob come lunch
ham,must come later normally bathe da afternoon mah
ham,b going 2 sch mon sis need 2 take smth
ham,oops shower u called hey parking garage collapsed university hospital see crazy stuff like happen
ham,wnt buy bmw car urgently vry hv shortage lt gt source arng dis amt lt gt lacs thats prob
spam,great new offer double mins double txt best orange tariffs get latest camera phones 4 free call mobileupd8 free 08000839402 2stoptxt cs
ham,sorry flaked last night shit seriously goin roommate tonight
ham,youdoing later sar xxx
ham,sorry bathroom sup
ham,nice talking please dont forget pix want see
ham,yo trip got postponed still stocked
ham,u studying sch going home anyway b going 2 sch later
ham,theyre lots places hospitals medical places safe
ham,aiyah e rain like quite big leh drizzling least run home
spam,2nd time tried 2 contact u 750 pound prize 2 claim easy call 08718726970 10p per min
ham,make time tonight whenever cool text whenever around
ham,picking various points
ham,love hear v see sundayish
spam,block breaker comes deluxe format new features great graphics buy replying get bbdeluxe take challenge
ham,yeah able text ready meet
spam,xmas reward waiting computer randomly picked loyal mobile customers receive reward call 09066380611
ham,call senthil hsbc
spam,promotion number 8714714 ur awarded city break could win summer shopping spree every wk txt store 88039 skilgme tscs087147403231winawk age16
ham,thk ü got ta go home urself cos b going shopping 4 frens present
ham,nothing ok anyway give treat
spam,mobile 11mths update free oranges latest colour camera mobiles unlimited weekend calls call mobile upd8 freefone 08000839402 2stoptx
ham,mmmm cant wait lick
ham,wake gt
ham,home please call
ham,sorry man accidentally left phone silent last night check til got
ham,daddy bb
ham,tmr ü brin lar aiya later come n c lar mayb ü neva set properly ü got da help sheet wif ü
ham,hello damn christmas thing think decided keep mp3 doesnt work
ham,ok
ham,hurt tease make cry end life die plz keep one rose grave say stupid miss u nice day bslvyl
ham,e best 4 ur exam later
ham,wat ü
spam,u outbid simonwatson5120 shinco dvd plyr 2 bid visit sms 2 end bid notifications reply end
ham,1 thing change sentence want 2 concentrate educational career im leaving
ham,night ended another day morning come special way may smile like sunny rays leaves worries blue blue bay gud mrng
ham,ok
ham,one joys lifeis waking daywith thoughts somewheresomeone cares enough tosend warm morning greeting
ham,yo around friend mine lookin pick later tonight
ham,come
ham,way home long dry spell season would
ham,hi keen go kind feel go tomo mind
ham,hi hun im comin every1 im sorry 4 hope u ava goodtime oli rang melnite ifink mite b sorted il explain everythin
ham,exactly anyways far jide study visiting
ham,ok
ham,finished eating got u plate leftovers time
ham,hi cts employee
ham,wot student discount u get books
ham,anything lar
ham,got called tool
ham,call unable cal lets meet bhaskar deep
ham,hoping get away 7 langport still town tonight
ham,yuou working getting pc mom find spot would work need
ham,hi home calicut
ham,life style garments account please
ham,sure mean get made hold weed
ham,yeah work fine started last week stuff dull easy guys fun
spam,sms services inclusive text credits pls goto unsubscribe stop extra charge po box420 ip4 5we
ham,people tour thought sofa thing sent curious sugar
ham,planned yet going join company jan 5 know happen
ham,hey darlin pick u college u tell wen 2 mt love pete xx
ham,everybody fun evening miss
ham,r u sam p eachother meet go 2 house
ham,watever relation u built dis world thing remains atlast iz lonlines lotz n lot memories feeling
ham,gokila talking aha
ham,aiyar hard 2 type u later free tell call n scold n tell u
ham,k eng rocking ashes
ham,mum hope great day hoping text meets well full life great day abiola
ham,aiyo u poor thing u dun wan 2 eat u bathe already
ham,got lt gt way could pick
ham,today accept day u accept brother sister lover dear1 best1 clos1 lvblefrnd jstfrnd cutefrnd lifpartnr belovd swtheart bstfrnd rply means enemy
ham,645
ham,wat r u
ham,someone smoke every time smoked last two weeks calling texting wanted smoke
ham,4 tacos 1 rajas burrito right
ham,texted finished long time ago showered
ham,great run ttyl
spam,free tones hope enjoyed new content text stop 61610 unsubscribe provided
ham,find sent offline message know anjola
ham,okey dokey bit sorting stuff
ham,looks like found something smoke great job
ham,safe trip nigeria wish happiness soon company share moments
ham,sorry call later
ham,yes many sweets
ham,dun wear jeans lor
spam,ur chance win wkly shopping spree txt shop c custcare 08715705022
ham,yes said
ham,drop tank
ham,ok nothing problem
ham,cool ta luv 2 cause doin loads planning wk got social services inspection nursery take care spk sn x
ham,dunno dad said coming home 2 bring us 4 lunch yup go w u lor call u reach school lor
ham,excellent ready moan scream ecstasy
ham,home
ham,girl stay bed girl need recovery time id rather pass fun cooped bed
ham,u wan 2 come dinner tonight
ham,ok least armand still around
ham,oh yeah forgot u take 2 shopping
ham,actually first time went bed long spoke woke night
ham,jus finished avatar nigro
ham,btw regarding really try see anyone else 4th guy commit random dude
ham,good baby
ham,increase chance winning
ham,also sir sent email log usc payment portal send another message explain things back home great weekend
ham,yeah worse
ham,hmm uncle informed paying school directly pls buy food
ham,school starting stay weather like food social support system like friends school things important
ham,gud care
spam,free ringtone reply real poly eg real1 pushbutton dontcha babygoodbye golddigger webeburnin 1st tone free 6 u join
ham,try making another butt
spam,urgent 2nd attempt contact u u 09071512432 b4 300603t 50
ham,hope great day
ham,birthday feb lt gt da
ham,reason spoken year anyways great week best exam
ham,lol u trust
ham,didnt search online let know
ham,hello saturday go texting see decided anything tomo trying invite anything
ham,back bit long cos accident a30 divert via brilliant weekend thanks speak soon lots love
spam,ur balance ur next question sang girl 80 2 answer txt ur answer good luck
ham,cuz ibored wan na study
ham,real tho sucks ca even cook whole electricity hungry
ham,aight tomorrow around lt gt
spam,free ringtone waiting collected simply text password mix 85069 verify get usher britney fml po box 5249 mk17 92h 450ppw 16
ham,murderer coz man murdered lt gt th january public holiday closed including post office understand
ham,cool let know kicks around lt gt day
ham,bit ur smile hppnss drop ur tear sorrow part ur heart life heart like mine wil care u forevr goodfriend
ham,ü call make sure dat woken
ham,opinion jada kusruthi lovable silent spl character matured stylish simple pls reply
ham,aight chillin friend room text way
spam,back 2 work 2morro half term u c 2nite 4 sexy passion b4 2 go back chat 09099726481 luv dena calls
ham,free call sir waiting
ham,tomorrow onwards eve 6 3 work
ham,accidentally deleted message resend please
ham,good good job like entrepreneurs
ham,hungry buy smth home
ham,road cant txt
ham,u calling right call hand phone
ham,know thinkin malaria relax children cant handle malaria would worse gastroenteritis takes enough replace loss temp reduce give malaria meds vomit self limiting illness means days completely stop
ham,ok thats cool either raglan rd edward rd behind cricket ground gim ring ur closeby see tuesday
ham,solve case man found murdered lt decimal gt lt gt afternoon 1 wife called police 2 police questioned everyone 3 wife sir sleeping murder took place cooking picking vegetables went 2 post office went 2 play went 2 marriage police arrested murderer immediately reply reason u r brilliant
ham,nobody names penis girls name story add
ham,ducking chinchillas
ham,want send something sell fast lt gt k easy money
ham,also thk fast xy suggest one u dun wan going 2 rain leh got gd
ham,ok wif cos like 2 try new things scared u dun like mah cos u said loud
ham,girl waiting reception ah
ham,means u could keep ur words
ham,naughty little thought better flirt flirt n flirt rather loving someone n gettin hurt hurt n hurt gud nyt
ham,hiya comin 2 bristol 1 st week april les got rudi new yrs eve drunk u bak college yet work sends ink 2 bath
ham,yar say got error
ham,opinion jada kusruthi lovable silent spl character matured stylish simple pls reply
spam,accordingly repeat text word ok mobile phone send
ham,sorry man account dry would want could trade back half could buy shit credit card
ham,well watch shrek 3d b
ham,stayin trouble stranger saw dave day sorted still bloke u gona get girl mr ur mum still thinks get 2getha
ham,life alle mone eppolum oru pole allalo
ham,try g decided head
ham,gone get info bt dont know
ham,tired slept well past nights
ham,told hr want posting chennai working
ham,perhaps much easy give account identification tomorrow uni
ham,yup giving problems mayb jus leave
ham,said anything wrong sorry de
ham,armand says get ass epsilon
spam,u r subscribed 2 textcomp 250 wkly comp 1st wk free question follows subsequent wks charged unsubscribe txt stop 2 84128 custcare 08712405020
ham,auntie huai juan never pick phone
ham,many times lose best ones bcoz
ham,worry though understand important put place poorly thought punishment face worst thing ever happened brb gon na go kill
ham,uncles atlanta wish guys great semester
ham,ow u paid told u would call
ham,love working home
ham,jokin oni lar ü busy wun disturb ü
ham,haha get used driving usf man know lot stoners
ham,ü got wat buy tell us ü need come
ham,mode men left
ham,freezing craving ice fml
ham,unlimited texts limited minutes
ham,know account details ask mom send mom reach
ham,realise busy guy trying bother get exams outta way try cars gr8 day
ham,ya knw u vl giv ok thanks kano anyway enjoy wit ur family wit 1st salary
ham,fighting world easy u either win lose bt fightng some1 close u dificult u lose u lose u win u still lose
ham,ya tel wats ur problem
ham,importantly discuss u
ham,aight still want get money
ham,hi probably much fun get message thought id txt u cos im bored james farting night
ham,true easier
spam,married local women looking discreet action 5 real matches instantly phone text match 69969 msg cost 150p 2 stop txt stop bcmsfwc1n3xx
ham,one interested may business plan
ham,get ready moan scream
ham,prashanthettan mother passed away last night pray family
ham,man carlos definitely coming mu tonight excuses
ham,hi spoke maneesha like know satisfied experience reply toll free yes
spam,2nd time tried 2 contact u pound prize 2 claim easy call 087187272008 now1 10p per minute
ham,pls help tell ashley cant find number oh
ham,k k good going
ham,many people seems special first sight remain special till last sight maintain till life ends take cr da
ham,ok anybody asks abt u tel
ham,ü come n pick 530 ar
ham,life spend someone lifetime may meaningless moments spent someone really love means life
ham,purchase stuff today mail po box number
ham,enjoy showers possessiveness poured u ur loved ones bcoz world lies golden gift loved truly
ham,oic cos n sis got lunch today dad went dunno whether 2 eat sch wat
ham,aiya discuss later lar pick ü 4
ham,well desperate call armand
ham,stopped get ice cream go back
spam,urgent mobile 07808726822 awarded bonus caller prize 2nd attempt contact call box95qu
ham,hi love goes day fuck morning woke dropped cell way stairs seems alright phews miss
ham,finished class
ham,see cup coffee animation
ham,alright set text man
