category,processed_message
ham,sometimes heart remembrs someone much forgets someone soon bcoz heart like everyone liked ones remembered everytime bslvyl
ham,dunno lets go learn pilates
ham,staying town
spam,449050000301 price claim call 09050000301
ham,ü collecting ur laptop going configure da settings izzit
spam,win cash prize prize worth
ham,call lt gt min thats ok
ham,good night dear sleepwell amp take care
ham,ill 3 mins look
ham,hit move
spam,todays voda numbers ending 5226 selected receive 350 award hava match please call 08712300220 quoting claim code 1131 standard rates app
ham,mostly sports type lyk footbl crckt
ham,k k special today
ham,oh oh wasted den muz chiong sat n sun liao
ham,could ask carlos could get anybody else chip
ham,xy going 4 e lunch
ham,cme want go hos 2morow wil cme got dear didnt say time
ham,today system sh get well also deep well
ham,hey happen de alright
ham,big god bring success
ham,sorry light turned green meant another friend wanted lt gt worth may around
ham,went project centre
ham,wait still clear sure sarcastic x want live us
ham,love aathi love u lot
ham,dunno close oredi ü v fan
spam,win winner foley ipod exciting prizes soon keep eye ur mobile visit
ham,tomarrow want got court lt decimal gt come bus stand 9
ham,murderer coz man murdered lt gt th january public holiday closed including post office understand
ham,going wipro interview today
spam,urgent call 09066350750 landline complimentary 4 ibiza holiday cash await collection sae cs po box 434 sk3 8wp 150 ppm
ham,whatever want know rules talk earlier week start happening showing responsibility yet every week bend rule way way whatever tired thia argument every week lt gt movie doesnt inlude previews still getting 1
ham,ask abt e movie u wan ktv oso
ham,yes think office lap room think thats last days didnt shut
ham,pay lt decimal gt lakhs
ham,boy late 2 home father power frndship
ham,fetch yun u fetch
ham,luv u soo much u understand special u r 2 ring u 2morrow luv u xxx
ham,oh ho first time u use type words
ham,done oredi
ham,u call
ham,wish u many many returns day happy birthday vikky
ham,always brainy one
spam,thanks ringtone order reference number mobile charged tone arrive please call customer services 09065989182
ham,food
ham,pls speak customer machan
ham,im gloucesterroad uup later
ham,ha ha cool cool chikku chikku
ham,happy sad one thing past good morning
ham,ok whats ur todays plan
ham,completed degree use joining finance
ham,fact leave think addie goes back school tues wed
ham,lmao fish memory need
ham,clothes jewelry trips
spam,hi sexychat girls waiting text text great night chatting send stop stop service
ham,sorry call later
ham,class holla later
ham,ok thanx take care
ham,size elephant tablets u shove um ur ass
ham,hmm yeah grooved im looking forward pound special
ham,sorry da thought calling lot times lil call noon
ham,zoe hit 2 im fucking shitin il defo try hardest 2 cum 2morow luv u millions lekdog
ham,excellent spent lt gt years air force iraq afghanistan stable honest like traveling
ham,hi kate lovely see tonight ill phone tomorrow got sing guy gave card xxx
ham,plz note anyone calling mobile amp asks u type lt gt lt gt disconnect call coz iz attempt make use sim card itz confirmd nokia n motorola n verified cnn ibn
ham,avatar supposed subtoitles
ham,u konw waht rael friendship im gving yuo exmpel jsut ese tihs msg evrey splleing tihs msg wrnog bt sitll yuo raed wihtuot ayn mitsake goodnight amp nice sleep sweet dreams
ham,shoot big loads get ready
spam,dear voucher holder claim weeks offer pc please go http ts cs apply
ham,remember day
ham,might want pull case plan spending much confidence derek taylor money management
ham,two cartons u pleased shelves
ham,vivek got call number
ham,u konw waht rael friendship im gving yuo exmpel jsut ese tihs msg evrey splleing tihs msg wrnog bt sitll yuo raed wihtuot ayn mitsake goodnight amp nice sleep sweet dreams
ham,watching tv lor nice one like lor
ham,best watch say cause get drunk motherfucker
spam,ripped get mobile content call 08717509990 six downloads 3
ham,huh got lesson 4 lei n thinkin going sch earlier n tot parkin kent vale
ham,u definitely need module e humanities dis sem izzit u wan 2 take modules 1st
ham,frnd necesity life imagine urself witout frnd hw u feel ur colleg wat u wth ur cell wat abt functions thnk abt events espe cared missed amp irritated u 4wrd frnds wthout u cant live jst takecare goodmorning
ham,ca speak bcaz mobile problem listen listen voice calls later
ham,post l8r class
ham,hey looks like wrong one kappa guys numbers still phone want text see around
ham,oh really make air talent
ham,like shaking booty dance floor
ham,got gas money chance gang want go grand nature adventure
ham,think fixed send test message
ham,eh sorry leh din c ur msg sad already lar watching tv u still office
ham,yes saw message
ham,right meanwhile project twins comin
ham,busy trying finish new year looking forward finally meeting
spam,urgent 4 costa del sol holiday await collection call 09050090044 toclaim sae tc pobox334 stockport sk38xh max10mins
ham,say bold torch later one torch 2bold
ham,usually body takes care buy making sure doesnt progress pls continue talk saturday
ham,howz come said medicine
ham,alex knows guy sells mids south tampa think could set like 8
ham,use foreign stamps country
ham,r u sure understand wine good idea slurp
ham,issues right ill fix tomorrow
ham,lol know awesome phone could click delete right want
ham,going tirunelvali week see uncle already spend amount taking dress want give feb 1
ham,orh tot u say still dun believe
ham,way
ham,dont pick call something important tell hrishi
ham,getting worried derek taylor already assumed worst
ham,sir waiting letter
ham,ujhhhhhhh computer shipped address sandiago parantella lane wtf poop
ham,hi yijue meet u 11 tmr
ham,check rooms befor activities
ham,hey gals anyone u going e driving centre tmr
ham,good afternoon loverboy goes day luck come way think sweetie send love across sea make smile happy
ham,great aunts anniversary party tarpon springs
ham,n funny
ham,use soc use home ü dunno 2 type word ar
ham,yes princess want make happy
ham,ü noe ben going
ham,yet chikku going room nw bus
ham,studying free next weekend
ham,come n pick ü come immediately aft ur lesson
ham,nah straight bring bud drinks something actually little useful straight cash
ham,really getting hanging around
ham,make squeezed lt gt bucks dad
ham,hide anythiing keeping distance
ham,shower baby
spam,knock knock txt whose 80082 enter r weekly draw 4 gift voucher 4 store yr choice cs age16
ham,coming back thursday yay gon na ok get money cheers oh yeah everything alright hows school call work
ham,lol wo feel bad use money take steak dinner
ham,make baby yo tho
ham,come room come house cos house still messy haha
spam,winner u specially selected 2 receive 4 holiday flights inc speak live operator 2 claim
ham,enjoy watching playing football basketball anything outdoors
ham,wait 2 min stand bus stop
ham,symptoms u love like listening songs get stopped u see name beloved wo get angry
ham,u say leh course nothing happen lar say v romantic jus bit lor thk e nite scenery nice leh
ham,customer place call
ham,delhi chennai still silent
spam,registered subscriber yr draw 4 gift voucher b entered receipt correct ans next olympics txt ans 80062
spam,want new nokia 3510i colour phone deliveredtomorrow 300 free minutes mobile 100 free texts free camcorder reply call 08000930705
ham,ü home work meh
ham,jst change tat
ham,sindu got job birla soft
ham,ü neva tell noe home da aft wat
ham,k k pa lunch aha
ham,ok take ur time n enjoy ur dinner
spam,urgent trying contact todays draw shows prize guaranteed call 09058094507 land line claim valid 12hrs
ham,sounds good fingers makes difficult type
ham,walked hour 2 c u show care wont u believe im serious
ham,8 min go lunch
ham,type stuff sing
ham,time n smile r two crucial things life sometimes time makes us forget smile sometimes someone smile makes us forget time gud noon
ham,happy birthday may ur dreams come true
ham,yes fine love safe
ham,yes last practice
ham,oh charge camera
ham,deep sigh miss really surprised gone net cafe yet get miss
ham,yesterday going home
ham,honey boo missing u
ham,idk sitting stop shop parking lot right bawling eyes feel like failure everything nobody wants feel like failing
ham,1 go write msg 2 put dictionary mode 3 cover screen hand 4 press lt gt 5 gently remove ur hand interesting
ham,diet ate 1 many slices pizza yesterday ugh always diet
spam,please call 08712402578 immediately urgent message waiting
ham,oh got many responsibilities
ham,da car park
ham,wylie tampa sarasota
ham,say god love amp need clean heart ten special people amp u c miracle tomorrow pls pls
ham,hate call didnt accept even single call mine even messaged
ham,lmao fun
ham,tell friends plan valentines day lt url gt
ham,hey iouri gave number wylie ryan friend
ham,ü wait 4 sch finish ard 5
ham,wait lt gt min
ham,yes really great bhaji told kallis best cricketer sachin world tough get
ham,per request alaipayuthe set callertune callers press 9 copy friends callertune
ham,done handed celebrations full swing yet
ham,belive come home
ham,uncles atlanta wish guys great semester
ham,u find sitter kaitlyn sick slept day yesterday
spam,please call customer service representative freephone 0808 145 4742 guaranteed cash prize
ham,yup shd haf ard 10 pages add figures ü got many pages
ham,ü ü wan come come lor din c stripes skirt
ham,good afternoon boytoy goes walking day get police abstract still wake miss babe
spam,free msg sorry service ordered 81303 could delivered sufficient credit please top receive service
ham,lol take member said aunt flow visit 6 months cause developed ovarian cysts bc way shrink
ham,dunno u ask
ham,sorry call later ok bye
ham,hello boytoy geeee miss already woke wish bed cuddling love
spam,xxxmobilemovieclub use credit click wap link next txt message click http
ham,need person give na
ham,nooooooo gon na bored death day cable internet outage
ham,cant pick phone right pls send message
ham,thinking going reg pract lessons flung advance haha wat time u going
ham,hope know still mad
ham,whore unbelievable
ham,greatest test courage earth bear defeat without losing heart gn tc
ham,get home
ham,aight sorry take ten years shower plan
ham,v nice 2 sheffield tom 2 air opinions categories 2 b used 2 measure ethnicity next census busy transcribing
ham,place get rooms cheap
ham,juz remembered got ta bathe dog today
ham,emigrated something ok maybe bit hopeful
ham,already sabarish asked go
ham,lol know dramatic schools already closed tomorrow apparently ca drive inch snow supposed get
ham,wahala remember friend need
ham,okay well thanks clarification
ham,yeah got list u joanna feeling really anti social
ham,yes one woman man please tell likes dislikes bed
ham,could seen recognise face
ham,wan early lei outside wun b home early neva mind
spam,ur balance next question complete landmark big bob barry ben text b c good luck
ham,ask around lot terms mids
ham,good morning princess happy new year
ham,yup need jus wait 4 e rain 2 stop
ham,coffee cake guess
ham,wen ur lovable bcums angry wid u dnt take seriously coz angry childish n true way showing deep affection care n luv kettoda manda nice day da
ham,k ill need srs model pls send mail id pa
ham,sorry call later
ham,howz pain hope u r fine
ham,got ten bucks jay noncomittal
spam,tried call reply sms video mobile 750 mins unlimited text free camcorder reply call 08000930705
ham,dont file bag work called tell find anything room
spam,sppok ur mob halloween collection nokia logo pic message plus free eerie tone txt card spook 8007
ham,jay snickering tells x totally fucking chords speak
ham,work mon thurs sat cant leh booked liao day u free
ham,also piece
spam,want funk ur fone weekly new tone reply tones2u 2 text original n best tones 3gbp network operator rates apply
ham,sure yet still trying get hold
ham,call phone vibrate acting might hear texts
ham,ok gon na head usf like fifteen minutes
ham,watching cartoon listening music amp eve go temple amp church u
ham,k wen ur free come home also tel vikky hav sent mail also better come evening il free today aftr 6pm
ham,basket gettin full might tonight
ham,haha awesome 4u couple times coming
spam,contacted dating service someone know find call mobile landline 09064017305 pobox75ldns7
ham,get cash together text jason
ham,one issues california okay snow manageable
ham,en chikku nange bakra msg kalstiya
ham,jokin lar depends phone father get lor
ham,k addie amp art get home
spam,congrats nokia 3650 video camera phone call 09066382422 calls cost 150ppm ave call 3mins vary mobiles close 300603 post bcm4284 ldn wc1n3xx
ham,something u ate
ham,marriage function
ham,hmmm imagine come home rub feet make dinner help get ready date sure ready kind life
spam,bored speed dating try speedchat txt speedchat 80155 like em txt swap get new chatter chat80155 pobox36504w45wq rcd 16
ham,nope juz work
ham,painful thought happy toughest thing earth toughest acting happy unspoken pain inside
ham,way home went change batt 4 watch go shop bit lor
ham,hey sweet wondering moment might come want send file someone wo go yahoo connection sucks remember set page go download format disc could tell know way download big files download stuff directly internet help would great prey teasing kiss
ham,forget tell want need crave love sweet arabian steed mmmmmm yummy
spam,freemsg unlimited free calls activate smartcall txt call unlimited calls help 08448714184 stop txt stop landlineonly
ham,missed call cause yelling scrappy miss ca wait u come home lonely today
ham,trip ok quite tiring lor uni starts today ok 4 cos taking modules jus concentrating final yr project
ham,think need going late school night especially one class one missed last wednesday probably failed test friday
ham,u coming back 4 dinner rite dad ask confirm wif u
ham,met stranger choose friend long world stands friendship never ends lets friends forever gud nitz
ham,k ready lt gt
ham,carlos says pick later yeah set
ham,dunno cos v late n reach inside already ate spageddies lor e gals r laughing lor
ham,arms fine cardiff uni
ham,good hear
spam,congratulations u claim 2 vip row tickets 2 c blu concert november blu gift guaranteed call 09061104276 claim ts cs
ham,call plz number shows coveragd area urgnt call vasai amp reach 4 clock call plz
ham,ü wait 4 bus stop aft ur lect lar dun c ü go get car come back n pick ü
ham,hi baby ive got back work wanting see u allday hope didnt piss u phone today u give call xxx
ham,see forwarding message proof
ham,k must book huh going yoga basic sunday
ham,tmr timin still da wat cos got lesson 6
ham,dude u knw also telugu thts gud k gud nyt
ham,height confidence aeronautics professors wer calld amp wer askd 2 sit aeroplane aftr sat wer told dat plane ws made students dey hurried plane bt 1 didnt move said made students wont even start datz confidence
ham,dint slept afternoon
spam,message free welcome new improved sex dogging club unsubscribe service reply stop msgs 150p
ham,checking
ham,yup studying surfing lor e lazy mode today
spam,buy space invaders 4 chance 2 win orig arcade game console press 0 games arcade std wap charge see 4 terms settings purchase
ham,tonight yeah
ham,u got persons story
ham,bought test yesterday something lets know exact day u get 2u 2 3wks pls pls dont fret know u r worried pls relax also anything ur past history u need tell
ham,already one guy loving
ham,amazing rearrange letters gives meaning dormitory dirty room astronomer moon starer eyes see election results lies lets recount woman hitler eleven plus two plus one amazing
ham,haha friend tyler literally asked could get dubsack
spam,mobile 11mths update free oranges latest colour camera mobiles unlimited weekend calls call mobile upd8 freefone 08000839402 2stoptxt
ham,still working time also tried adding zeros savings checking lt gt
ham,dun b sad dun thk abt already concentrate ur papers k
ham,hello wen u finish fancy meetin wiv u tonite need break dabooks 4 hrs last today wrk
ham,wat da decision
ham,guess lt gt min
spam,4mths half price orange line rental latest camera phones 4 free phone 11mths call mobilesdirect free 08000938767 update or2stoptxt
ham,hows favourite person today r u workin hard could sleep last nite nearly rang u
ham,ok prob
ham,dont give monkeys wot think certainly mind friend mine sleep wiv wud annoyin
ham,hi princess thank pics pretty
ham,yo im right yo work
ham,easy ah sen got selected means good
ham,guys go see movies side
spam,jamster get crazy frog sound poly text mad1 real text mad2 88888 6 crazy sounds 3 c apply
ham,eyes philosophy
ham,hi hope good day better night
ham,im good thinking
ham,hi dude hw r u da realy mising u today
ham,erm thought contract ran the4th october
ham,yeah probably swing roommate finishes girl
spam,missed call alert numbers called left message 07008009200
ham,k u bored come home
ham,time coming
ham,competition
ham,uh heads much left
spam,orange customer may claim free camera phone upgrade loyalty call 0207 153 offer ends 14thmarch c apply availa
ham,hiya u like hlday pics looked horrible took mo hows camp amrca thing speak soon serena
spam,guess somebody know secretly fancies wan na find give us call 09065394973 landline datebox1282essexcm61xn 18
ham,friendship poem dear dear u r near hear dont get fear live cheer tear u r always dear gud ni8
ham,dad wanted talk apartment got late start omw
ham,stupid say challenge dont think write instead respond immed
ham,usf guess might well take 1 car
ham,great
ham,remember hurt days satanic imposter pay price destiny keep going u said pray get mind get
ham,oi gon na ring
ham,campus library
ham,sounds like could lot time spent chastity device boy grins take beatings like good dog going lounge nice long bath
spam,18 days euro2004 kickoff u kept informed latest news results daily unsubscribe send get euro stop 83222
ham,would ip address test considering computer minecraft server
ham,going 2 orchard laready reaching soon u reaching
ham,yeah probably still got ta check leo
ham,gentle baby soon taking lt gt inches deep inside tight pussy
ham,course maths one day one chapter one month finish
ham,yo guess dropped
ham,hope alright babe worry might felt bit desparate learned job fake waiting come back love
ham,hmmm guess go 4 kb n power yoga haha dunno tahan power yoga anot thk got lo oso forgot liao
spam,win year supply cds 4 store ur choice worth enter weekly draw txt music 87066 ts cs
ham,ok lor
ham,could work reach consensus next meeting
ham,yo around got car back
ham,ful song lyrics
ham,entered cabin pa said happy boss felt special askd 4 lunch lunch invited apartment went
ham,becoz lt gt jan whn al post ofice holiday cn go fr post ofice got duffer
ham,helloooo wake sweet morning welcomes enjoy day full joy gud mrng
ham,pls send address sir
ham,call
ham,whens radio show
ham,easy mate guess quick drink bit ambitious
ham,hi engagement fixd lt gt th next month know really shocking bt hmm njan vilikkam ws al sudn
ham,lt gt mca conform
ham,take care financial help
ham,doesnt need test
ham,dude go sup
ham,come guoyang go n tell u told
ham,keep payasam rinu brings
spam,someone u know asked dating service 2 contact cant guess call 09058097189 revealed pobox 6 ls15hb 150p
ham,cant get da laptop matric card wif ü lei
ham,ai answerin phone actually pretty reasonable hour sleepy
ham,aldrine rakhesh ex rtm
ham,guess worried must know way body repairs quite sure worry take slow first tests guide ovulation relax nothing said reason worry keep followin
ham,know yetunde sent money yet sent text bother sending dont involve anything imposed anything first place apologise
ham,got lots hair dresser fr china
spam,hi amy sending free phone number couple days give access adult parties
ham,good words words may leave u dismay many times
ham,7 wonders world 7th 6th ur style 5th ur smile 4th ur personality 3rd ur nature 2nd ur sms 1st ur lovely friendship good morning dear
ham,u early
ham,pls speak wont ask anything friendship
ham,ca take major roles community outreach rock mel
spam,thanks 4 continued support question week enter u in2 draw 4 cash name new us president txt ans 80082
spam,hot live fantasies call 08707509020 20p per min ntt ltd po box 1327 croydon cr9 5wb 0870 national rate call
ham,rose red red blood blood heart heart u send tis ur friends including u like u get back r poor relation need 1 support r frnd 2 many luvs u some1 praying god marry try
ham,tot group mate lucky havent reply wat time ü need leave
ham,wan na art
ham,hospital da return home evening
ham,next lt gt hours imma flip shit
ham,dip cell dead coming u better respond else shall come back
ham,cos want thing
ham,way put skip right outside front house see house pull
ham,sorry call later
ham,pub
ham,flippin shit yet
ham,dad went oredi
ham,thought put back box
ham,come slave going shell unconsciously avoiding making unhappy
ham,gal n boy walking park hold ur hand u think would run away jst wana c feels walking heaven prince gn
ham,cos shopping wif darren jus n called 2 ask wat present wan lor started guessing wif n finally guessed darren lor
spam,cash prize claim call09050000327 c rstm sw7 3ss 150ppm
ham,wat late still early mah juz go 4 dinner lor aiya dunno
ham,howz persons story
ham,go tell friend sure want live smokes much spend hours begging come smoke
ham,got ur mail muchand look forward lots support less contacts remember one venugopal late shall try come till dear
ham,day class class
ham,okey doke home dressed cos laying around ill speak later bout times stuff
ham,somewhere fredericksburg
ham,yeah go bed back midnight
ham,saw k da
ham,smoking people use wylie smokes much justify ruining shit
ham,ugh got outta class
ham,boys made fun today ok problem sent one message fun
ham,talking thats de wont
ham,solve case man found murdered lt decimal gt lt gt afternoon 1 wife called police 2 police questioned everyone 3 wife sir sleeping murder took place cooking picking vegetables went 2 post office went 2 play went 2 marriage police arrested murderer immediately reply reason u r brilliant
ham,hmm dunno leh mayb bag 4 goigng dat small jus anything except perfume smth dat keep
ham,joy father john john name joy father mandan
ham,ok days making dinner tonite invited
ham,cramps stopped going back sleep
ham,hungry buy food good lei mum n yun dun wan juz buy little bit
ham,cant u try new invention fly
spam,xmas offer latest motorola sonyericsson nokia free bluetooth double mins 1000 txt orange call mobileupd8 08000839402
ham,havent
ham,cool shall go see go tip anyway home got something drop later lets go town tonight maybe mum take us
spam,todays vodafone numbers ending 4882 selected receive award number matches call 09064019014 receive award
ham,hi chikku send nice msgs
ham,sch fr dun haf da book sch home
ham,ok u enjoy ur shows
ham,guess useless calling u 4 something important
ham,cheers u tex mecause u werebored yeah okden hunny r uin wk sat likeyour havin gr8fun j keep updat countinlots loveme xxxxx
ham,ok ok take care understand
ham,stitch trouser
spam,ree entry 2 weekly comp chance win ipod txt pod 80182 get entry std txt rate c apply 08452810073 details
ham,popping lt gt ibuprofens help
ham,nah dub je still buff
ham,calls messages missed calls
spam,ur hmv quiz currently maximize ur send hmv1 86688
ham,bus way calicut
ham,awesome text restocked
ham,lol always convincing
ham,good swimsuit allowed
ham,get class bsn like lt gt minutes know advising
ham,omg u know ate
ham,happy birthday lots nri
ham,get free call
ham,night ended another day morning come special way may smile like sunny rays leaves worries blue blue bay
spam,nokia 7250i get win free auction take part send nokia 86021
spam,sms ac jsco energy high u may know 2channel 2day ur leadership skills r strong psychic reply ans end reply end jsco
ham,dont know bring food
ham,moji informed saved lives thanks
ham,meeting u work tel shall work tomorrow
ham,geeeee love much barely stand
ham,love ass enjoy doggy style
ham,im late tellmiss im way
spam,4 costa del sol holiday await collection call 09050090044 toclaim sae tc pobox334 stockport sk38xh max10mins
ham,gon na pick 1 burger way home ca even move pain killing
ham,hey want crave miss need love ahmad saeed al hallaq
ham,yes obviously potato speak soon
ham,hey mate spoke mag people deliver end month deliver 24th talk later
ham,aathi dear
ham,arun u transfr amt
ham,kay since already
ham,yes see ya dot
ham,minor shindig place later tonight interested
ham,today song dedicated day song u dedicate send ur valuable frnds first rply
ham,bruce b downs amp fletcher
ham,oh think wi nz players unsold
ham,u see posted facebook
spam,lyricalladie inviting friend reply see stop send stop frnd 62468
ham,okies go yan jiu skip ard oso go cine den go mrt one blah blah blah
ham,good sleep rhythm person establish rhythm body learn use want know
ham,knew u slept v late yest wake late
ham,per request melle oru minnaminunginte nurungu vettam set callertune callers press 9 copy friends callertune
ham,wana fal luv vth books bed fals luv vth yen madodu nav pretsorginta nammanna pretsovru important alwa gud
spam,know u u know send chat 86688 let find rcvd ldn 18 years
spam,want new video handset 750 time network mins unlimited text camcorder reply call 08000930705 del sat
ham,much textin bout
ham,u gon na get deus ex
ham,lt gt mins stop somewhere first
ham,hi jess dont know work call u im home eve xxx
ham,noice text
spam,forwarded 21870000 hi mailbox messaging sms alert 40 matches please call back 09056242159 retrieve messages matches
ham,pure hearted person wonderful smile makes even enemies feel guilty enemy catch world smile goodmorning amp smiley sunday
ham,hey come online use msn
ham,ü submitting da project tmr rite
ham,hey morning come ask pa
ham,double eviction week spiral michael good riddance
ham,jay says
